name,live,github,screenshot,description
ecommerce,https://crwn-ecom-test.herokuapp.com/,https://github.com/HussainIslam/ecommerce_react,portfolio_ecommerce.png,"This is an e-commerce website built with React, Redux, and Firebase. Deployed in Heroku"
realtor,http://167.99.112.252/,https://github.com/HussainIslam/Realtor_App,portfolio_realtor.png,This is an app for real estate app built with Django and Jinja. Deployed in Digital Ocean
employee management,https://serene-gorge-25201.herokuapp.com/,https://github.com/HussainIslam/employeeManagementBasic,portfolio_employee.png,"This is an employee management app built with Node.js, MongoDB, Express, and multer. It is deployed in heroku"
loan_calculator,https://hussainislam.github.io/LoanRepaymentSchedule/,https://github.com/HussainIslam/LoanRepaymentSchedule,portfolio_loan_calculator.png,"This is a loan calculator created with HTML, CSS, and Vanilla Javascript."
dictionary,https://hussainislam.github.io/Dictionary/,https://github.com/HussainIslam/Dictionary,portfolio_dictionary.png,"This is a REST API based dictionary created with basic HTML, CSS, and Javascript"
calculator,https://hussainislam.github.io/Calculator/,https://github.com/HussainIslam/Calculator,portfolio_calculator.png,"This is a simple calculator built with HTML, CSS, and Vanilla JS"
movievue,https://amazing-bell-213807.netlify.app/,https://github.com/HussainIslam/Movie_Search_Vue.js,portfolio_movies.png,This is a REST API base site built with Vue.js where user can search for movies